{
  "$schema": "../../schemas/evidence_review_package_manifest_v1.schema.json",
  "answerable_question_count": 35,
  "calibration_counts": {
    "needs_human_review": 12,
    "strong_accept": 16,
    "strong_reject": 12
  },
  "generation_mode": "search_api_asgi_http",
  "input_sha256": {
    "builder": "190e45d6a1f1d2c9f66e64c58ed0c7b674a25ef8b2fd33b7d2b54851d6cff27f",
    "dense_baseline": "b3421ad828ee5165bd832cb1510b11e048c72ddd18b769e254018b2db5044833",
    "evaluation": "81d5a1374118b01d850d7c4808edf89b9432036a4488c49f5150720aa3fc8dee",
    "evidence_review_contract": "8a55dc8a37e1c37ec3b4a070c8d6feac4be80fc542bd9a6e80e3613f9c29de97",
    "manifest_schema": "d6084309b2626f271a3d339ed01ba627237442970081faffbcfb0112019df5f8",
    "request_schema": "23097956afea34171350b8ea1897f6c347ace1c2adafd0fe7de78ea4fc1a0da3",
    "reranking_human_notes": "6e51b135f67a78dd3bc34d71259c730d3e6d7a7b4cd3ff4961339169205e9e18",
    "response_schema": "ce7dd6aafe3667f9fbc33b097d1a6747c2eb165a7bc02034da23a1336a0133cf",
    "search_api_application": "41a03831c8a03167730f18145b6a294d986099c2bd23a6800a122c4b95d11b6c",
    "search_api_contract": "697c470c1acb94ac94ac61d09a91575f8431f6ed9d9ff2437bb6b8f4f535edae",
    "search_api_service": "746406be27d6929e86161b7ec45aca745389b2ff7a6a607c098a21fff6204412",
    "search_api_validation_manifest": "d3ae724b0f6783df52fcf024aa602a0cce763b18bb0364e770868e9e707811e5"
  },
  "out_of_scope_question_count": 5,
  "output_artifacts": [
    {
      "file": "evaluation/review/evidence_accept_reject/evidence_review_requests_v1.jsonl",
      "sha256": "1cafc735ec5a40cf0179c017f064dd9cd3d187f0a4b90564d68680928e257a3e"
    },
    {
      "file": "evaluation/review/evidence_accept_reject/evidence_review_calibration_v1.csv",
      "sha256": "9e47bebf57626d437a0757ce9f976c5c0e446c8600fe8465f81b755f94e7be1b"
    },
    {
      "file": "reports/13_evidence_review/evidence_review_package_validation.csv",
      "sha256": "5d082558af268d62c5f79204dadbcfe417d594da252f79cbab29eccf45df37b4"
    }
  ],
  "package_run_id": "mit60001_evidence_review_73fe8183b63eca56",
  "question_count": 40,
  "retrieval_identity": {
    "index_run_id": "mit60001_index_558e4d6e873847dd",
    "retrieval_method": "dense_baseline_v1",
    "search_api_validation_run_id": "mit60001_search_api_35767a6f304c4dc3",
    "top_k": 3
  },
  "schema_version": "evidence_review_package_manifest_v1",
  "validation_status": "passed"
}
